id,type,title,year,citation,url
amazon2023,report,2023 Amazon Sustainability Report,2023,Amazon Staff. (2023). Amazon Sustainability Report. https://sustainability.aboutamazon.com/2023-amazon-sustainability-report.pdf,https://sustainability.aboutamazon.com/2023-amazon-sustainability-report.pdf
chen2024,paper,Efficient Heterogeneous Large Language Model Decoding with Model-Attention Disaggregation,2024,"Shaoyuan Chen, Wencong Xiao, Yutong Lin, Mingxing Zhang, Yingdi Shan, Jinlei Jiang, Kang Chen, Yongwei Wu. (2024). Efficient Heterogeneous Large Language Model Decoding with Model-Attention Disaggregation. arXiv. https://arxiv.org/pdf/2405.01814",https://arxiv.org/pdf/2405.01814
chung2025,paper,The ML.ENERGY Benchmark: Toward Automated Inference Energy Measurement and Optimization,2025,"Jae-Won Chung, Jiachen Liu, Jeff J. Ma, Ruofan Wu, Oh Jun Kweon, Yuxuan Xia, Zhiyu Wu, Mosharaf Chowdhury (2025). The ML.ENERGY Benchmark: Toward Automated Inference Energy Measurement and Optimization. arXiv. https://arxiv.org/pdf/2505.06371",https://arxiv.org/pdf/2505.06371
cottier2024,paper,The Rising Costs of Training Frontier AI Models,2024,"Ben Cottier, Robi Rahman, Loredana Fattorini, Nestor Maslej, David Owen. (2024). The Rising Costs of Training Frontier AI Models. arXiv. https://arxiv.org/pdf/2405.21015",https://arxiv.org/pdf/2405.21015
dodge2022,paper,Measuring the Carbon Intensity of AI in Cloud Instances,2022,"Jesse Dodge, Taylor Prewitt, Remi Tachet Des Combes, Erika Odmark, Roy Schwartz, Emma Strubell, Alexandra Sasha Luccioni, Noah A. Smith, Nicole DeCario, Will Buchanan (2022). Measuring the Carbon Intensity of AI in Cloud Instances. FAccT '22. https://arxiv.org/pdf/2206.05229",https://arxiv.org/pdf/2206.05229
ebert2024,paper,"AI, Climate, and Regulation: From Data Centers to the AI Act",2024,"Kai Ebert, Nicolas Alder, Ralf Herbrich, & Philipp Hacker (2024). AI, climate, and regulation: From data centers to the AI act arXiv. https://arxiv.org/html/2410.06681v1",https://arxiv.org/pdf/2410.06681
erben2023,paper,How Can We Train Deep Learning Models Across Clouds and Continents? An Experimental Study,2023,"Alexander Erben, Ruben Mayer, & Hans-Arno Jacobsen (2023). How can we train deep learning models across clouds and continents? an experimental study arXiv. https://arxiv.org/pdf/2306.03163",https://arxiv.org/pdf/2306.03163
fernandez2025,paper,Energy Considerations of Large Language Model Inference and Efficiency Optimizations,2025,"Jared Fernandez Clara Na , Vashisth Tiwari , Yonatan Bisk , Sasha Luccioni, Emma Strubell. https://arxiv.org/pdf/2504.17674.pdf",https://arxiv.org/pdf/2504.17674
griggs2024,paper,M�lange: Cost Efficient Large Language Model Serving by Exploiting GPU Heterogeneity,2024,"Tyler Griggs, Xiaoxuan Liu, Jiaxiang Yu, Doyoung Kim, Wei-Lin Chiang, Alvin Cheung, Ion Stoica. (2024). Mélange: Cost Efficient Large Language Model Serving by Exploiting GPU Heterogeneity. arXiv. https://arxiv.org/pdf/2404.14527",https://arxiv.org/pdf/2404.14527
han2024,paper,The Unpaid Toll: Quantifying the Public Health Impact of AI,2024,"Yuelin Han, Zhifeng Wu, Pengfei Li, Adam Wierman, Shaolei Ren (2024). The Unpaid Toll: Quantifying the Public Health Impact of AI. arXiv. https://arxiv.org/pdf/2412.06288",https://arxiv.org/pdf/2412.06288
jegham2025,paper,"How Hungry is AI? Benchmarking Energy, Water and Carbon Footprint of LLM Inference",2025,"Nidhal Jegham, Marwan Abdelatti, Lassad Elmoubarki, Abdeltawab Hendawi (2025). How Hungry is AI? Benchmarking Energy, Water and Carbon Footprint of LLM Inference. arXiv. https://arxiv.org/pdf/2505.09598",https://arxiv.org/pdf/2505.09598
khan2025,paper,"Optimizing Large Language Models: Metrics, Energy Efficiency, and Case Study Insights",2025,"Tahniat Khan, Soroor Motie, Sedef Akinli Kocak, & Shaina Raza (2025). Optimizing large language models: Metrics, energy efficiency, and case study insights arXiv. https://arxiv.org/pdf/2504.06307",https://arxiv.org/pdf/2504.06307
kim2025,paper,Cost-Efficient LLM Serving in the Cloud: VM Selection with KV Cache Offloading,2025,"Kihyun Kim, Jinwoo Kim, Hyunsun Chung, Myung-Hoon Cha, Hong-Yeon Kim, Youngjae Kim. (2025). Cost-Efficient LLM Serving in the Cloud: VM Selection with KV Cache Offloading. arXiv. https://arxiv.org/pdf/2504.11816",https://arxiv.org/pdf/2504.11816
li2025a,paper,FLM-101B: An Open LLM and How to Train It with $100K Budget,2025,"Xiang Li, Yiqun Yao, Xin Jiang, Xuezhi Fang, Xuying Meng, Siqi Fan, Peng Han, Jing Li, Li Du, Bowen Qin, Zheng Zhang, Aixin Sun, & Yequan Wang. (2025). FLM-101B: An Open LLM and How to Train It with $100K Budget. arXiv. https://arxiv.org/pdf/2309.03852",https://arxiv.org/pdf/2309.03852
li2025b,paper,Making AI Less 'Thirsty': Uncovering and Addressing the Secret Water Footprint of AI Models,2023,"Pengfei Li, Jianyi Yang, Mohammad A. Islam, Shaolei Renn (2023). Making AI Less 'Thirsty': Uncovering and Addressing the Secret Water Footprint of AI Models. arXiv. https://arxiv.org/pdf/2304.03271",https://arxiv.org/pdf/2304.03271
luccioni2023,paper,Counting Carbon: A Survey of Factors Influencing the Emissions of Machine Learning,2023,"Alexandra Sasha Luccioni, Alex Hernandez-Garcia (2023). Counting Carbon: A Survey of Factors Influencing the Emissions of Machine Learning. arXiv. https://arxiv.org/pdf/2302.08476",https://arxiv.org/pdf/2302.08476
luccioni2024,paper,Power Hungry Processing: Watts Driving the Cost of AI Deployment?,2024,"Alexandra Sasha Luccioni, Yacine Jernite, Emma Strubell. (2024). Power Hungry Processing: Watts Driving the Cost of AI Deployment?. arXiv. https://arxiv.org/pdf/2311.16863",https://arxiv.org/pdf/2311.16863
luccioni2025a,paper,From Efficiency Gains to Rebound Effects: The Problem of Jevons' Paradox in AI's Polarized Environmental Debate,2025,"Alexandra Sasha Luccioni, Emma Strubell, Kate Crawford (2025). From Efficiency Gains to Rebound Effects: The Problem of Jevons' Paradox in AI's Polarized Environmental Debate. FAccT '25. https://arxiv.org/pdf/2501.16548",https://arxiv.org/pdf/2501.16548
luccioni2025b,paper,Bridging the Gap: Integrating Ethics and Environmental Sustainability in AI Research and Practice,2025,"Alexandra Sasha Luccioni, Giada Pistilli, Raesetje Sefala, Nyalleng Moorosi (2025). Bridging the Gap: Integrating Ethics and Environmental Sustainability in AI Research and Practice. arXiv. https://arxiv.org/pdf/2504.00797",https://arxiv.org/pdf/2504.00797
luccioni2025c,paper,Misinformation by Omission: The Need for More Environmental Transparency in AI,2025,"Alexandra Sasha Luccioni, Boris Gamazaychikov, Theo Alves da Costa, Emma Strubell (2025). Misinformation by Omission: The Need for More Environmental Transparency in AI. arXiv. https://arxiv.org/pdf/2506.15572",https://arxiv.org/pdf/2506.15572
morrison2025,paper,Holistically Evaluating the Environmental Impact of Creating Language Models,2025,"Jacob Morrison, Clara Na, Jared Fernandez, Tim Dettmers, Emma Strubell, Jesse Dodge (2025). Holistically Evaluating the Environmental Impact of Creating Language Models. arXiv. https://arxiv.org/pdf/2503.05804",https://arxiv.org/pdf/2503.05804
patterson2021,paper,Carbon Emissions and Large Neural Network Training,2021,"David Patterson, Joseph Gonzalez, Quoc Le, Chen Liang, Lluis-Miquel Munguia, Daniel Rothchild, David So, Maud Texier, Jeff Dean (2021). Carbon Emissions and Large Neural Network Training. arXiv. https://arxiv.org/pdf/2104.10350",https://arxiv.org/pdf/2104.10350
rubei2025,paper,Prompt engineering and its implications on the energy consumption of Large Language Models,2025,"Riccardo Rubei, Aicha Moussaid, Claudio Di Sipio, & Davide Di Ruscio (2025). Prompt engineering and its implications on the energy consumption of large language models arXiv. https://arxiv.org/pdf/2501.05899",https://arxiv.org/pdf/2501.05899
samsi2024,paper,From Words to Watts: Benchmarking the Energy Costs of Large Language Model Inference,2023,"Siddharth Samsi, Dan Zhao, Joseph McDonald, Baolin Li, Adam Michaleas, Michael Jones, William Bergeron, Jeremy Kepner, Devesh Tiwari, & Vijay Gadepally (2023). From words to watts: Benchmarking the energy costs of large language model inference arXiv. https://arxiv.org/pdf/2310.03003",https://arxiv.org/pdf/2310.03003
schwartz2019,paper,Green AI,2019,"Roy Schwartz, Jesse Dodge, Noah A. Smith, Oren Etzioni (2019). Green AI. Communications of the ACM. https://arxiv.org/pdf/1907.10597",https://arxiv.org/pdf/1907.10597
shen2024,paper,JetMoE: Reaching Llama2 Performance with 0.1M Dollars,2024,"Yikang Shen, Zhen Guo, Tianle Cai, Zengyi Qin. (2024). JetMoE: Reaching Llama2 Performance with 0.1M Dollars. arXiv. https://arxiv.org/pdf/2404.07413",https://arxiv.org/pdf/2404.07413
stone2022,paper,Artificial Intelligence and Life in 2030: The One Hundred Year Study on Artificial Intelligence,2022,"Peter Stone, Rodney Brooks, Erik Brynjolfsson, Ryan Calo, Oren Etzioni, Greg Hager, Julia Hirschberg, Shivaram Kalyanakrishnan, Ece Kamar, Sarit Kraus, Kevin Leyton-Brown, David Parkes, William Press, AnnaLee Saxenian, Julie Shah, Milind Tambe, Astro Teller (2022). Artificial Intelligence and Life in 2030: The One Hundred Year Study on Artificial Intelligence. arXiv. https://arxiv.org/pdf/2211.06318",https://arxiv.org/pdf/2211.06318
strubell2019,paper,Energy and Policy Considerations for Deep Learning in NLP,2019,"Emma Strubell, Ananya Ganesh, Andrew McCallum (2019). Energy and Policy Considerations for Deep Learning in NLP. ACL. https://arxiv.org/pdf/1906.02243",https://arxiv.org/pdf/1906.02243
wu2021a,paper,"Sustainable AI: Environmental Implications, Challenges and Opportunities",2021,"Carole-Jean Wu, Ramya Raghavendra, Udit Gupta, Bilge Acun, Newsha Ardalani, Kiwan Maeng, Gloria Chang, Fiona Aga Behram, James Huang, Charles Bai, Michael Gschwind, Anurag Gupta, Myle Ott, Anastasia Melnikov, Salvatore Candido, David Brooks, Geeta Chauhan, Benjamin Lee, Hsien-Hsin S. Lee, Bugra Akyildiz, Maximilian Balandat, Joe Spisak, Ravi Jain, Mike Rabbat, Kim Hazelwood (2021). Sustainable AI: Environmental Implications, Challenges and Opportunities. arXiv. https://arxiv.org/pdf/2111.00364",https://arxiv.org/pdf/2111.00364
wu2021b,paper,SOCIO-TECHNOLOGICAL CHALLENGES AND OPPORTUNITIES: PATHS FORWARD,2021,"Carole-Jean Wu, Srilatha Manne, Parthasarathy Ranganathan, Sarah Bird, & Shane Greenstein (2021). SOCIO-TECHNOLOGICAL CHALLENGES AND OPPORTUNITIES: PATHS FORWARD arXiv. https://arxiv.org/pdf/2108.06738",https://arxiv.org/pdf/2108.06738
xia2024,paper,Understanding the Performance and Estimating the Cost of LLM Fine-Tuning,2024,"Yuchen Xia, Jiho Kim, Yuhan Chen, Haojie Ye, Souvik Kundu, Cong Hao, Nishil Talati. (2024). Understanding the Performance and Estimating the Cost of LLM Fine-Tuning. arXiv. https://arxiv.org/pdf/2408.04693",https://arxiv.org/pdf/2408.04693
zschache2025,paper,Comparing energy consumption and accuracy in text classification inference,2025,"Johannes Zschache, & Tilman Hartwig (2025). Comparing energy consumption and accuracy in text classification inference arXiv. https://arxiv.org/pdf/2508.14170",https://arxiv.org/pdf/2508.14170 
ren2024,paper,Reconciling the Contrasting Narratives on the Environmental Impact of Large Language Models,2024,"Shaolei Ren, Bill Tomlinson, Rebecca W. Black, A. Torrance (2024). Reconciling the contrasting narratives on the environmental impact of large language models. Scientific Reports. https://arxiv.org/pdf/2409.07116",https://arxiv.org/pdf/2409.07116
li2024_water,paper,Towards Sustainable GenAI using Generation Directives for Carbon-Friendly Large Language Model Inference,2024,"Baolin Li, Yankai Jiang, Vijay Gadepally, Devesh Tiwari (2024). Towards Sustainable GenAI using Generation Directives for Carbon-Friendly Large Language Model Inference. arXiv. https://arxiv.org/pdf/2403.12900",https://arxiv.org/pdf/2403.12900
acun2023,paper,Carbon Explorer: A Holistic Framework for Designing Carbon Aware Datacenters,2023,"Bilge Acun, Benjamin Lee, Fiodar Kazhamiaka, Kiwan Maeng, Udit Gupta, Manoj Chakkaravarthy, David Brooks, Carole-Jean Wu (2023). Carbon Explorer: A Holistic Framework for Designing Carbon Aware Datacenters. ASPLOS '23. https://arxiv.org/pdf/2210.02681",https://arxiv.org/pdf/2210.02681
radovanovic2022,paper,Carbon-Aware Computing for Datacenters,2022,"Ana Radovanovic, Ross Koningstein, Ian Schneider, Bokan Chen, Alexandre Duber, Binz Roy, David Talaber, Drew Ferguson, Nic Tills, Kathy Zhu, Max Nova, Jared Chen, Ken Hua (2022). Carbon-Aware Computing for Datacenters. IEEE TPDS. https://arxiv.org/pdf/2106.11750",https://arxiv.org/pdf/2106.11750
desislavov2023,paper,Trends in AI Inference Energy Consumption: Beyond the Performance-vs-Parameter Laws of Deep Learning,2023,"Radosvet Desislavov, Fernando Martinez-Plumed, Jose Hernandez-Orallo (2023). Trends in AI Inference Energy Consumption: Beyond the Performance-vs-Parameter Laws of Deep Learning. Sustainable Computing. https://arxiv.org/pdf/2301.00774",https://arxiv.org/pdf/2301.00774
samsi2023_gpu,paper,Benchmarking Large Language Models on Supercomputers,2023,"Siddharth Samsi, Dan Zhao, Andrew Gittens, David Bader, Vijay Gadepally (2023). Benchmarking Large Language Models on Supercomputers. arXiv. https://arxiv.org/pdf/2402.05065",https://arxiv.org/pdf/2402.05065
xu2024,paper,A Survey on Model Compression for Large Language Models,2024,"Xunyu Zhu, Jian Li, Yong Liu, Can Ma, Weiping Wang (2024). A Survey on Model Compression for Large Language Models. TACL. https://arxiv.org/pdf/2308.07633",https://arxiv.org/pdf/2308.07633
stojkovic2024,paper,Towards Greener LLMs: Bringing Energy-Efficiency to the Forefront of LLM Inference,2024,"Jovan Stojkovic, Esha Choukse, Chaojie Zhang, Inigo Goiri, Josep Torrellas (2024). Towards Greener LLMs: Bringing Energy-Efficiency to the Forefront of LLM Inference. arXiv. https://arxiv.org/pdf/2403.20306",https://arxiv.org/pdf/2403.20306
chavan2024,paper,Faster and Lighter LLMs: A Survey on Current Challenges and Way Forward,2024,"Arnav Chavan, Raghav Magazine, Shubham Kushwaha, Mérouane Debbah, Deepak Gupta (2024). Faster and Lighter LLMs: A Survey on Current Challenges and Way Forward. IJCAI. https://arxiv.org/pdf/2402.01799",https://arxiv.org/pdf/2402.01799
gupta2022,paper,Chasing Carbon: The Elusive Environmental Footprint of Computing,2022,"Udit Gupta, Young Geun Kim, Sylvia Lee, Jordan Tse, Hsien-Hsin S. Lee, Gu-Yeon Wei, David Brooks, Carole-Jean Wu (2022). Chasing Carbon: The Elusive Environmental Footprint of Computing. HPCA '22. https://arxiv.org/pdf/2011.02839",https://arxiv.org/pdf/2011.02839
faiz2024,paper,LLMCarbon: Modeling the End-to-End Carbon Footprint of Large Language Models,2024,"Ahmad Faiz, Sotaro Kaneda, Ruhan Wang, Rita Osi, Prateek Sharma, Fan Chen, Lei Jiang (2024). LLMCarbon: Modeling the End-to-End Carbon Footprint of Large Language Models. ICLR '24. https://arxiv.org/pdf/2309.14393",https://arxiv.org/pdf/2309.14393
lannelongue2021,paper,Green Algorithms: Quantifying the Carbon Footprint of Computation,2021,"Loic Lannelongue, Jason Grealey, Michael Inouye (2021). Green Algorithms: Quantifying the Carbon Footprint of Computation. Advanced Science. https://arxiv.org/pdf/2007.07610",https://arxiv.org/pdf/2007.07610
bommasani2024,paper,The Foundation Model Transparency Index v1.1,2024,"Rishi Bommasani, Kevin Klyman, Shayne Longpre, Betty Xiong, Sayash Kapoor, Nestor Maslej, Arvind Narayanan, Percy Liang (2024). The Foundation Model Transparency Index v1.1. arXiv. https://arxiv.org/pdf/2407.12929",https://arxiv.org/pdf/2407.12929
bannour2024,paper,A Systematic Review of Green AI,2024,"Nada Bannour, Sahar Ghannay, Aurelien Nedelec, Anne Vilnat (2024). A Systematic Review of Green AI. Artificial Intelligence Review. https://arxiv.org/pdf/2301.11047",https://arxiv.org/pdf/2301.11047
tomlinson2024,paper,The Carbon Emissions of Writing and Illustrating Are Lower for AI than for Humans,2024,"Bill Tomlinson, Rebecca W. Black, Donald J. Patterson, Andrew W. Torrance (2024). The Carbon Emissions of Writing and Illustrating Are Lower for AI than for Humans. Scientific Reports. https://arxiv.org/pdf/2303.06219",https://arxiv.org/pdf/2303.06219
george2023,paper,Measuring the Environmental Impacts of Artificial Intelligence Compute and Applications,2023,"Sasha Luccioni, Alex Hernandez-Garcia, Jesse Dodge (2023). Measuring the Environmental Impacts of Artificial Intelligence Compute and Applications. arXiv. https://arxiv.org/pdf/2211.02001",https://arxiv.org/pdf/2211.02001
shumba2024,paper,A Water Efficiency Dataset for African Data Centers,2024,"Noah Shumba, Opelo Tshekiso, Pengfei Li, Giulia Fanti, Shaolei Ren (2024). A Water Efficiency Dataset for African Data Centers. arXiv. https://arxiv.org/pdf/2412.03716",https://arxiv.org/pdf/2412.03716
islam2025,paper,Electricity Demand and Grid Impacts of AI Data Centers: Challenges and Prospects,2025,Mohammad A. Islam et al. (2025). Electricity Demand and Grid Impacts of AI Data Centers: Challenges and Prospects. arXiv. https://arxiv.org/pdf/2509.07218,https://arxiv.org/pdf/2509.07218
waste2energy2025,paper,Waste-to-Energy-Coupled AI Data Centers: Cooling Efficiency and Grid Resilience,2025,(2025). Waste-to-Energy-Coupled AI Data Centers: Cooling Efficiency and Grid Resilience. arXiv. https://arxiv.org/pdf/2512.24683,https://arxiv.org/pdf/2512.24683
carbonrt2024,paper,Carbon Footprint Reduction for Sustainable Data Centers in Real-Time,2024,(2024). Carbon Footprint Reduction for Sustainable Data Centers in Real-Time. arXiv. https://arxiv.org/pdf/2403.14092,https://arxiv.org/pdf/2403.14092
dccooling2025,paper,Data Center Cooling System Optimization Using Offline Reinforcement Learning,2025,(2025). Data Center Cooling System Optimization Using Offline Reinforcement Learning. arXiv. https://arxiv.org/pdf/2501.15085,https://arxiv.org/pdf/2501.15085
h100power2025,paper,Empirically-Calibrated H100 Node Power Models,2025,(2025). Empirically-Calibrated H100 Node Power Models. arXiv. https://arxiv.org/pdf/2506.14551,https://arxiv.org/pdf/2506.14551
hwswcodesign2025,paper,Sustainable AI Training via Hardware-Software Co-Design,2025,(2025). Sustainable AI Training via Hardware-Software Co-Design. arXiv. https://arxiv.org/pdf/2508.13163,https://arxiv.org/pdf/2508.13163
intelperwatt2025,paper,Intelligence Per Watt: Measuring Intelligence Efficiency of Local AI,2025,(2025). Intelligence Per Watt: Measuring Intelligence Efficiency of Local AI. arXiv. https://arxiv.org/pdf/2511.07885,https://arxiv.org/pdf/2511.07885
promptspower2025,paper,From Prompts to Power: Measuring the Energy Footprint of LLM Inference,2025,(2025). From Prompts to Power: Measuring the Energy Footprint of LLM Inference. arXiv. https://arxiv.org/pdf/2511.05597,https://arxiv.org/pdf/2511.05597
quantbatch2026,paper,"Understanding Efficiency: Quantization, Batching, and Serving Strategies in LLM Energy Use",2026,"(2026). Understanding Efficiency: Quantization, Batching, and Serving Strategies in LLM Energy Use. arXiv. https://arxiv.org/pdf/2601.22362",https://arxiv.org/pdf/2601.22362
edgequant2025,paper,Sustainable LLM Inference for Edge AI: Evaluating Quantized LLMs for Energy Efficiency,2025,"(2025). Sustainable LLM Inference for Edge AI: Evaluating Quantized LLMs for Energy Efficiency, Output Accuracy, and Inference Latency. arXiv. https://arxiv.org/pdf/2504.03360",https://arxiv.org/pdf/2504.03360
dvfs2025,paper,Investigating Energy Efficiency and Performance Trade-offs in LLM Inference Across Tasks and DVFS Settings,2025,(2025). Investigating Energy Efficiency and Performance Trade-offs in LLM Inference Across Tasks and DVFS Settings. arXiv. https://arxiv.org/pdf/2501.08219,https://arxiv.org/pdf/2501.08219
elsworth2025,paper,Life-Cycle Emissions of AI Hardware: A Cradle-To-Grave Approach and Generational Trends,2025,Cooper Elsworth et al. (2025). Life-Cycle Emissions of AI Hardware: A Cradle-To-Grave Approach and Generational Trends. arXiv. https://arxiv.org/pdf/2502.01671,https://arxiv.org/pdf/2502.01671
falk2025,paper,More than Carbon: Cradle-to-Grave Environmental Impacts of GenAI Training on the Nvidia A100 GPU,2025,Sophia Falk et al. (2025). More than Carbon: Cradle-to-Grave Environmental Impacts of GenAI Training on the Nvidia A100 GPU. arXiv. https://arxiv.org/pdf/2509.00093,https://arxiv.org/pdf/2509.00093
beyondeff2024,paper,Beyond Efficiency: Scaling AI Sustainably,2024,(2024). Beyond Efficiency: Scaling AI Sustainably. arXiv. https://arxiv.org/pdf/2406.05303,https://arxiv.org/pdf/2406.05303
scopingreview2025,paper,Toward Sustainable Generative AI: A Scoping Review of Carbon Footprint,2025,(2025). Toward Sustainable Generative AI: A Scoping Review of Carbon Footprint. arXiv. https://arxiv.org/pdf/2511.17179,https://arxiv.org/pdf/2511.17179
aiservers2026,paper,The Environmental Impact of AI Servers and Sustainable Solutions,2026,(2026). The Environmental Impact of AI Servers and Sustainable Solutions. arXiv. https://arxiv.org/pdf/2601.06063,https://arxiv.org/pdf/2601.06063
google2025,paper,Measuring the Environmental Impact of Delivering AI at Google Scale,2025,(2025). Measuring the Environmental Impact of Delivering AI at Google Scale. arXiv. https://arxiv.org/pdf/2508.15734,https://arxiv.org/pdf/2508.15734
greenaisurvey2025,paper,"Green AI: A Systematic Review and Meta-Analysis of Its Definitions, Lifecycle Models, Hardware and Measurement Attempts",2025,(2025). Green AI: A Systematic Review and Meta-Analysis. arXiv. https://arxiv.org/pdf/2511.07090,https://arxiv.org/pdf/2511.07090
treviso2022,paper,The Cost of Training NLP Models: A Concise Overview,2022,"Marcos Treviso, Ji-Ung Lee, Tianchu Ji, Betty van Aken, Qingqing Cao, Manuel R. Ciosici, Michael Hassid, Kenneth Heafield, Sara Hooker, Colin Raffel, Pedro H. Martins, Andre F. T. Martins, Jessica Zosa Forde, Peter Grabowski, Chester Palen-Michel, Ann Clifton, Yufang Hou, Hal Daume III, Iryna Gurevych, Roy Schwartz (2022). The Cost of Training NLP Models: A Concise Overview. arXiv. https://arxiv.org/pdf/2206.07160",https://arxiv.org/pdf/2206.07160
skypilot2023,paper,SkyPilot: An Intercloud Broker for Sky Computing,2023,"Zongheng Yang, Zhanghao Wu, Michael Luo, Wei-Lin Chiang, Romil Bhardwaj, Woosuk Kwon, Siyuan Zhuang, Frank Sifei Luan, Gautam Mittal, Scott Shenker, Ion Stoica (2023). SkyPilot: An Intercloud Broker for Sky Computing. NSDI '23. https://arxiv.org/pdf/2205.07147",https://arxiv.org/pdf/2205.07147
spotserve2024,paper,SpotServe: Serving Generative Large Language Models on Preemptible Instances,2024,"Xupeng Miao, Chunan Shi, Jiangfei Duan, Xiaoli Xi, Dahua Lin, Bin Cui, Zhihao Jia (2024). SpotServe: Serving Generative Large Language Models on Preemptible Instances. ASPLOS '24. https://arxiv.org/pdf/2311.15566",https://arxiv.org/pdf/2311.15566
sia2023,paper,"Sia: Heterogeneity-aware, Goodput-optimized ML-Cluster Scheduling",2023,"Suhas Jayaram Subramanya, Daiyaan Arfeen, Shouxu Lin, Aurick Qiao, Zhihao Jia, Gregory R. Ganger (2023). Sia: Heterogeneity-aware, Goodput-optimized ML-Cluster Scheduling. SOSP '23. https://arxiv.org/pdf/2306.00954",https://arxiv.org/pdf/2306.00954
pollux2022,paper,Pollux: Co-adaptive Cluster Scheduling for Goodput-Optimized Deep Learning,2022,"Aurick Qiao, Sang Keun Choe, Suhas Jayaram Subramanya, Willie Neiswanger, Qirong Ho, Hao Zhang, Gregory R. Ganger, Eric P. Xing (2022). Pollux: Co-adaptive Cluster Scheduling for Goodput-Optimized Deep Learning. OSDI '21. https://arxiv.org/pdf/2008.12260",https://arxiv.org/pdf/2008.12260
waterscarf2025,paper,Not All Water Consumption Is Equal: A Water Stress Weighted Metric for Sustainable Computing,2025,(2025). Not All Water Consumption Is Equal: A Water Stress Weighted Metric for Sustainable Computing. arXiv. https://arxiv.org/pdf/2506.22773,https://arxiv.org/pdf/2506.22773
islami2024,paper,Environmental Impact and Policy Implications of AI-Driven Water Consumption in Data Centers,2024,"Md Amimul Ihsan Aquil, Md Arafat Alam, Ahmed Imteaj (2024). Environmental Impact and Policy Implications of AI-Driven Water Consumption in Data Centers. arXiv. https://arxiv.org/pdf/2412.13853",https://arxiv.org/pdf/2412.13853
lcopt2025,paper,LC-Opt: Benchmarking RL and Agentic AI for End-to-End Liquid Cooling Optimization in Data Centers,2025,(2025). LC-Opt: Benchmarking Reinforcement Learning and Agentic AI for End-to-End Liquid Cooling Optimization in Data Centers. arXiv. https://arxiv.org/pdf/2511.00116,https://arxiv.org/pdf/2511.00116
greenllm2025,paper,Green-LLM: Optimal Workload Allocation for Environmentally-Aware Distributed Inference,2025,"Jiaming Cheng, D. Nguyen (2025). Green-LLM: Optimal Workload Allocation for Environmentally-Aware Distributed Inference. arXiv. https://arxiv.org/pdf/2505.02309",https://arxiv.org/pdf/2505.02309
moore2025,paper,Sustainable Carbon-Aware and Water-Efficient LLM Scheduling in Geo-Distributed Cloud Datacenters,2025,"Hayden Moore, Sirui Qi, Ninad Hogade, D. Milojicic, Cullen E. Bash, S. Pasricha (2025). Sustainable Carbon-Aware and Water-Efficient LLM Scheduling in Geo-Distributed Cloud Datacenters. GLSVLSI '25. https://arxiv.org/pdf/2505.23554",https://arxiv.org/pdf/2505.23554
luccioni2022bloom,paper,"Estimating the Carbon Footprint of BLOOM, a 176B Parameter Language Model",2023,"Alexandra Sasha Luccioni, Sylvain Viguier, Anne-Laure Ligozat (2023). Estimating the Carbon Footprint of BLOOM, a 176B Parameter Language Model. JMLR. https://arxiv.org/pdf/2211.02001",https://arxiv.org/pdf/2211.02001
ligozat2022,paper,Unraveling the Hidden Environmental Impacts of AI Solutions for Environment,2022,"Anne-Laure Ligozat, Julien Lefevre, Aurelie Bugeau, Jacques Combaz (2022). Unraveling the Hidden Environmental Impacts of AI Solutions for Environment Life Cycle Assessment of AI Solutions. Sustainability. https://arxiv.org/pdf/2110.11822",https://arxiv.org/pdf/2110.11822
